<!ELEMENT settings (section+)>
<!ELEMENT section (title, description, action)>
<!ELEMENT title (#PCDATA)>
<!ELEMENT description (#PCDATA)>
<!ELEMENT action (#PCDATA)>
